{
  "gains": {
    "flight": {
      "u": {
        "p": 30.0,
        "i": 1.5,
        "d": 0.0,
        "v": 5.0,
        "pid_min": -50,
        "pid_max": 50
      },
      "v": {
        "p": 5.0,
        "i": 0.2,
        "d": 0.0,
        "v": 5.0,
        "pid_min": -15,
        "pid_max": 15
      },
      "z": {
        "p": 15.0,
        "i": 1.0,
        "d": 0.0,
        "v": 5.0,
        "pid_min": -30,
        "pid_max": 30
      },
      "roll": {
        "p": 2.0,
        "i": 0.1,
        "d": 0.0,
        "v": 5.0,
        "pid_min": -10,
        "pid_max": 10
      },
      "pitch": {
        "p": 5.0,
        "i": 1.0,
        "d": 0.0,
        "v": 5.0,
        "pid_min": -20,
        "pid_max": 20
      },
      "yaw": {
        "p": 4.0,
        "i": 0.2,
        "d": 0.0,
        "v": 5.0,
        "pid_min": -15,
        "pid_max": 15
      }
    },
    "docking": {
      "x": {
        "p": 10.0,
        "i": 0.2,
        "d": 0.0,
        "v": 5.0,
        "pid_min": -15,
        "pid_max": 15
      },
      "y": {
        "p": 10.0,
        "i": 0.2,
        "d": 0.0,
        "v": 5.0,
        "pid_min": -15,
        "pid_max": 15
      },
      "z": {
        "p": 15.0,
        "i": 1.0,
        "d": 0.0,
        "v": 5.0,
        "pid_min": -30,
        "pid_max": 30
      },
      "roll": {
        "p": 2.0,
        "i": 0.1,
        "d": 0.0,
        "v": 5.0,
        "pid_min": -10,
        "pid_max": 10
      },
      "pitch": {
        "p": 5.0,
        "i": 1.0,
        "d": 0.0,
        "v": 5.0,
        "pid_min": -20,
        "pid_max": 20
      },
      "yaw": {
        "p": 4.0,
        "i": 0.2,
        "d": 0.0,
        "v": 5.0,
        "pid_min": -15,
        "pid_max": 15
      }
    }
  },
  "mission": {
    "schema": "piccard.race-auv.pose-mission/v1",
    "mission_id": "race-auv-docking-drift-and-revisit",
    "question": "With the station tags in view, then out of view for two legs of about five minutes each, then in view again, how far does the EKF drift during each leg, and what do the tags show at each re-sighting?",
    "frame_id": "world_ned",
    "child_frame_id": "cg_link",
    "seed": null,
    "apriltag_tag_size": "black_square_edge",
    "poses": [
      {
        "label": "dive",
        "x_m": -0.325,
        "y_m": 0.0,
        "z_m": 3.78,
        "roll_rad": 0.0,
        "pitch_rad": 0.0,
        "yaw_rad": 1.571,
        "dwell_s": 40
      },
      {
        "label": "approach",
        "x_m": -0.325,
        "y_m": 4.8,
        "z_m": 3.78,
        "roll_rad": 0.0,
        "pitch_rad": 0.0,
        "yaw_rad": 1.571,
        "dwell_s": 150
      },
      {
        "label": "view_1",
        "x_m": -0.325,
        "y_m": 4.8,
        "z_m": 3.78,
        "roll_rad": 0.0,
        "pitch_rad": 0.0,
        "yaw_rad": 1.571,
        "dwell_s": 60
      },
      {
        "label": "leg_1_turn",
        "x_m": -0.325,
        "y_m": 4.8,
        "z_m": 3.78,
        "roll_rad": 0.0,
        "pitch_rad": 0.0,
        "yaw_rad": -1.571,
        "dwell_s": 30
      },
      {
        "label": "leg_1_a",
        "x_m": 1.5,
        "y_m": 1.3,
        "z_m": 3.78,
        "roll_rad": 0.0,
        "pitch_rad": 0.0,
        "yaw_rad": -1.571,
        "dwell_s": 150
      },
      {
        "label": "leg_1_b",
        "x_m": -2.0,
        "y_m": 1.3,
        "z_m": 3.78,
        "roll_rad": 0.0,
        "pitch_rad": 0.0,
        "yaw_rad": -1.571,
        "dwell_s": 150
      },
      {
        "label": "return_1",
        "x_m": -0.325,
        "y_m": 4.8,
        "z_m": 3.78,
        "roll_rad": 0.0,
        "pitch_rad": 0.0,
        "yaw_rad": 1.571,
        "dwell_s": 120
      },
      {
        "label": "leg_2_turn",
        "x_m": -0.325,
        "y_m": 4.8,
        "z_m": 3.78,
        "roll_rad": 0.0,
        "pitch_rad": 0.0,
        "yaw_rad": -1.571,
        "dwell_s": 30
      },
      {
        "label": "leg_2_a",
        "x_m": -2.0,
        "y_m": 1.3,
        "z_m": 3.78,
        "roll_rad": 0.0,
        "pitch_rad": 0.0,
        "yaw_rad": -1.571,
        "dwell_s": 150
      },
      {
        "label": "leg_2_b",
        "x_m": 1.5,
        "y_m": 1.3,
        "z_m": 3.78,
        "roll_rad": 0.0,
        "pitch_rad": 0.0,
        "yaw_rad": -1.571,
        "dwell_s": 150
      },
      {
        "label": "return_2",
        "x_m": -0.325,
        "y_m": 4.8,
        "z_m": 3.78,
        "roll_rad": 0.0,
        "pitch_rad": 0.0,
        "yaw_rad": 1.571,
        "dwell_s": 120
      },
      {
        "label": "hold",
        "x_m": -0.325,
        "y_m": 4.8,
        "z_m": 3.78,
        "roll_rad": 0.0,
        "pitch_rad": 0.0,
        "yaw_rad": 1.571,
        "dwell_s": 180
      }
    ]
  },
  "horizon_s": 1800,
  "wall_timeout_s": 1950,
  "context": {
    "purpose": "drift-and-revisit dataset for RACE tag-aided localization (piccard-inc/piccard-physical-ai#265, D2; the Claude CTO's ruling of 2026-10-09); data for an offline estimator, not a docking trial",
    "gain_sources": {
      "flight": "upstream race_auv da58963 config_sim.yaml flight mode, unchanged",
      "docking.z/roll/pitch/yaw": "copied from the flight mode",
      "docking.x/y": "M2 selection p10 (p 10, i 0.2, d 0, v 5, +/-15), as the M3 examples"
    },
    "apriltag_tag_size": "black_square_edge, set explicitly: a pose mission defaults to lab_configured, whose detections read 1.25 x long (runtime/mission.py: the lab's configured size is the 0.15 m texture box, the black square 0.8 of it; #265 D0)",
    "pose_derivation": "stand-off: cg_link at Stonefish world (1.0, 0.325, 3.78) heading north (yaw_W 0), the AUV dock point 2.2 m from the station dock point (3.59, 0.325, 3.91), the forward camera 2.3-2.4 m from tags 146, 541 and 558; legs: cg_link at world (-2.5, -1.5) and (-2.5, 2.0), 3.78 m deep, heading south (yaw_W pi), the station behind the vehicle; in the controller's world_ned (x_C = -y_W, y_C = x_W + 3.8, yaw_C = yaw_W + 1.571) the stand-off is (-0.325, 4.8), the legs (1.5, 1.3) and (-2.0, 1.3), all at least 1.0 m inside the tank bounds; the dive is M1's (examples/m1-smoke-request.json)",
    "visibility": "tools/analysis/race_tag_visibility.py on this mission: each leg pose puts no station tag inside either camera's field of view widened by 10 deg; each stand-off pose puts tags 146, 541 and 558 in the forward camera's view inside the ranges where the detector found them reliably (541 from 2.75 m and 558 from 3.0 m it mostly does not, so the stand-off is closer than 3 m)",
    "timing": "each leg is a 30 s turn in place at the stand-off and two 150 s poses, about 5.5 min with the station behind the vehicle; each return is 120 s, including the transit and the turn back; the dwells total 1,330 s of the 1,800 s horizon",
    "seed": "null: run_trial.sh draws one per trial and records it (simulator_seed.py, stonefish_seed_v1); three trials, three recorded seeds"
  }
}
